01:00.0 VGA compatible controller: NVIDIA Corporation GA104 [GeForce RTX 3070] (rev a1) (prog-if 00 [VGA controller])
	Subsystem: ASUSTeK Computer Inc. Device 8897
	Control: I/O+ Mem+ BusMaster+ SpecCycle- MemWINV- VGASnoop- ParErr- Stepping- SERR- FastB2B- DisINTx+
	Status: Cap+ 66MHz- UDF- FastB2B- ParErr- DEVSEL=fast >TAbort- <TAbort- <MAbort- >SERR- <PERR- INTx-
	Latency: 0, Cache Line Size: 64 bytes
	Interrupt: pin A routed to IRQ 98
	Region 0: Memory at fb000000 (32-bit, non-prefetchable) [size=16M]
	Region 1: Memory at d0000000 (64-bit, prefetchable) [size=256M]
	Region 3: Memory at c0000000 (64-bit, prefetchable) [size=32M]
	Region 5: I/O ports at e000 [size=128]
	Expansion ROM at fb800000 [virtual] [disabled] [size=512K]
	Capabilities: [60 v1] Power Management version 3
	Capabilities: [68 v1] MSI: Enable+ Count=1/1 Maskable- 64bit+
	Capabilities: [78 v1] Express Endpoint, MSI 00
		DevCap:	MaxPayload 256 bytes, PhantFunc 0, Ltr+
			DeviceAtt: 10
			DevCtl2: Completion Timeout: Range ABCD, TimeoutDis+, LTR+, 10BitTagReq-
		DevCtl:	CorrErr+ NonFatalErr+ FatalErr+ UnsupReq+
			MaxPayload 256 bytes, MaxReadReq 512 bytes
		LnkCap:	Port #0, Speed 16GT/s, Width x16, ASPM L0s L1, Exit Latency L0s <1us, L1 <8us
			ClockPM+ Surprise- LLActRep- BwNot- ASPMOptComp+
		LnkCtl:	ASPM L0s L1 Enabled; RCB 64 bytes, Disabled- CommClk+
			ExtSynch- ClockPM- AutWidDis- BWInt- AutBWInt-
		LnkSta:	Speed 8GT/s (downgraded), Width x16
			TrErr- Train- SlotClk+ DLActive- BwMgmt- ABWInt-
	Capabilities: [100 v1] Virtual Channel
	Capabilities: [250 v1] Latency Tolerance Reporting
	Capabilities: [258 v1] L1 PM Substates

01:00.1 Audio device: NVIDIA Corporation GA104 High Definition Audio Controller (rev a1)
	Subsystem: ASUSTeK Computer Inc. Device 8897
	Control: I/O- Mem+ BusMaster+ SpecCycle- MemWINV- VGASnoop- ParErr- Stepping- SERR- FastB2B- DisINTx+
	Status: Cap+ 66MHz- UDF- FastB2B- ParErr- DEVSEL=fast >TAbort- <TAbort- <MAbort- >SERR- <PERR- INTx-
	Latency: 0
	Capabilities: [48 v1] Power Management version 3
	Capabilities: [68 v1] MSI: Enable+ Count=1/1 Maskable- 64bit+
	Capabilities: [78 v1] Express Endpoint, MSI 00

02:00.0 Non-Volatile memory controller: Samsung Electronics Co Ltd NVMe SSD Controller SM981/PM981/PM983 (prog-if 02 [NVM Express])
	Subsystem: Samsung Electronics Co Ltd Device a801
	Control: I/O- Mem+ BusMaster+ SpecCycle- MemWINV- VGASnoop- ParErr- Stepping- SERR- FastB2B- DisINTx+
	Status: Cap+ 66MHz- UDF- FastB2B- ParErr- DEVSEL=fast >TAbort- <TAbort- <MAbort- >SERR- <PERR- INTx-
	Latency: 0
	Interrupt: pin A routed to IRQ 45
	Region 0: Memory at fcb00000 (64-bit, non-prefetchable) [size=16K]
	Capabilities: [40 v1] Power Management version 3
	Capabilities: [50 v1] MSI: Enable+ Count=8/8 Maskable- 64bit+
	Capabilities: [70 v1] Express Endpoint, MSI 00
		DevCap:	MaxPayload 256 bytes, PhantFunc 0, Ltr+
			DeviceAtt: 2
			DevCtl2: Completion Timeout: Range ABCD, TimeoutDis+, LTR+, 10BitTagReq-
		DevCtl:	CorrErr+ NonFatalErr+ FatalErr+ UnsupReq+
			MaxPayload 256 bytes, MaxReadReq 512 bytes
		LnkCap:	Port #0, Speed 8GT/s, Width x4, ASPM L1, Exit Latency L1 <64us
			ClockPM+ Surprise- LLActRep+ BwNot- ASPMOptComp+
		LnkCtl:	ASPM L1 Enabled; RCB 64 bytes, Disabled- CommClk+
			ExtSynch- ClockPM+ AutWidDis- BWInt- AutBWInt-
		LnkSta:	Speed 2.5GT/s (downgraded), Width x1 (downgraded)
			TrErr- Train- SlotClk+ DLActive+ BwMgmt- ABWInt-
	Capabilities: [b0 v1] Latency Tolerance Reporting
	Capabilities: [100 v2] Advanced Error Reporting
		UESta:	DLP- SDES- TLP- FCP- CmpltTO- CmpltAbrt- UnxCmplt- RxOF- MalfTLP- ECRC- UnsupReq- ACSViol-
		CESta:	RxErr- BadTLP- BadDLLP- Rollover- Timeout- AdvNonFatalErr-
		AERCap:	First Error Pointer: 00, ECRCGen+ ECRCChk+
	Capabilities: [160 v1] Physical Layer 16.0 GT/s
	Capabilities: [1c0 v1] Lane Margining at Receiver
